{
  "$id": "https://oaps.dev/schemas/profiles/provisioning-operation.json",
  "$schema": "https://json-schema.org/draft/2020-12/schema",
  "title": "OAPS Draft Provisioning Operation",
  "type": "object",
  "required": [
    "profile",
    "interaction_id"
  ],
  "properties": {
    "profile": {
      "type": "string"
    },
    "interaction_id": {
      "type": "string"
    },
    "state": {
      "type": "string"
    },
    "resource_type": {
      "type": "string"
    },
    "delivery": {
      "type": "object"
    },
    "payment_handoff": {
      "type": "object"
    }
  },
  "additionalProperties": true
}
